{"id": "f9b88381697a873d", "year": "B7", "strand": "Strand 1: Environment", "substrand": "Sub-strand 1: Environmental Issues", "content_standard_code": "B7.1.1.1", "indicator_code": "B7.1.1.1.1", "title": "B7 · Strand 1: Environment · Sub-strand 1: Environmental Issues · B7.1.1.1 · B7.1.1.1.1", "text": "Year: B7\nStrand: Strand 1: Environment\nSub-strand: Sub-strand 1: Environmental Issues\nContent Standard (B7.1.1.1): Demonstrate skills in dealing with environmental challenges\nIndicator (B7.1.1.1.1): Examine ways of dealing with sanitation challenges in the environment\nExemplars: Explain: (i) Environment (ii) Sanitation Discuss the types of environment (physical and social). Identify some environmental problems, including poor sanitation. Examine cultural practices and their related problems for sanitation in the community. Discuss the effects of poor sanitation practices. Identify different ways of managing sanitation problems. Embark on a project with the aim of managing sanitation problems in the community.\nCore Competencies: Critical Thinking and Problem Solving (CP); Communication and Collaboration (CC); Creativity and Innovation (CI); CP 5.1: Ability to combine information and ideas from several sources to reach a conclusion.; CP 5.2: Analyse and make distinct judgment about viewpoints expressed in an argument.; CP 6.1: Ability to effectively define goals towards solving a problem.; CP 6.2: Ability to explain plans for attaining goals.; CC 7.1: Identify words or sentences in context appropriately.; CC 7.2: Interpret correctly and respond to non-verbal communication such as facial expressions, cues and gestures.; CC 8.1: Speak clearly and explain ideas; share a narrative or extended answer while speaking to a group.; CI 5.1: Examine alternatives in creating new things.; CI 6.1: Exhibit strong memory, intuitive thinking, and respond appropriately.; CI 6.4: Imagining and seeing things in a different way.", "exemplars_text": "Explain: (i) Environment (ii) Sanitation Discuss the types of environment (physical and social). Identify some environmental problems, including poor sanitation. Examine cultural practices and their related problems for sanitation in the community. Discuss the effects of poor sanitation practices. Identify different ways of managing sanitation problems. Embark on a project with the aim of managing sanitation problems in the community.", "competencies": ["Critical Thinking and Problem Solving (CP)", "Communication and Collaboration (CC)", "Creativity and Innovation (CI)", "CP 5.1: Ability to combine information and ideas from several sources to reach a conclusion.", "CP 5.2: Analyse and make distinct judgment about viewpoints expressed in an argument.", "CP 6.1: Ability to effectively define goals towards solving a problem.", "CP 6.2: Ability to explain plans for attaining goals.", "CC 7.1: Identify words or sentences in context appropriately.", "CC 7.2: Interpret correctly and respond to non-verbal communication such as facial expressions, cues and gestures.", "CC 8.1: Speak clearly and explain ideas; share a narrative or extended answer while speaking to a group.", "CI 5.1: Examine alternatives in creating new things.", "CI 6.1: Exhibit strong memory, intuitive thinking, and respond appropriately.", "CI 6.4: Imagining and seeing things in a different way."], "path": ["B7", "Strand 1: Environment", "Sub-strand 1: Environmental Issues", "B7.1.1.1", "B7.1.1.1.1"], "source": "NaCCA Social Studies CCP (B7–B9), 2020/2021", "keywords": ["strand", "skills", "with", "Strand", "ways", "Environmental", "sanitation", "B7", "challenges", "environment", "Examine", "Issues", "environmental", "dealing", "Environment", "Demonstrate"], "metadata": {"curriculum": "CCP", "subject": "Social Studies", "country": "Ghana", "license": "© NaCCA, Ministry of Education 2021"}}
{"id": "d0c934217eab7c02", "year": "B7", "strand": "Strand 1: Environment", "substrand": "Sub-strand 1: Environmental Issues", "content_standard_code": "B7.1.1.2", "indicator_code": "B7.1.1.2.1", "title": "B7 · Strand 1: Environment · Sub-strand 1: Environmental Issues · B7.1.1.2 · B7.1.1.2.1", "text": "Year: B7\nStrand: Strand 1: Environment\nSub-strand: Sub-strand 1: Environmental Issues\nContent Standard (B7.1.1.2): Examine the sources of energy and demonstrate the skills of conserving energy in Ghana\nIndicator (B7.1.1.2.1): Examine the sources of energy.\nExemplars: Explain energy. Through the use of internet, videos or pictures, describe the sources of energy in Ghana, including fuel wood, hydro, solar and thermal. In groups, categorise sources of energy into renewable and non-renewable.\nCore Competencies: Critical Thinking and Problem Solving (CP); Communication and Collaboration (CC); Personal Development and Leadership (PL); Digital Literacy (DL); CP 5.1: Ability to combine information and ideas from several sources to reach a conclusion.; CP 5.2: Analyse and make distinct judgment about viewpoints expressed in an argument.; CC 8.1: Speak clearly and explain ideas; share a narrative or extended answer while speaking to a group.; CC 9.1: Demonstrate behaviour and skills of working towards group goals.; PL 6.1: Ability to serve group members effectively.; PL 6.3: Ability to manage time effectively.; DL 5.1: Ascertain when information is needed and identify, locate, evaluate and effectively use it to solve a problem.; DL 6.3: Use digital tools to create novel things.", "exemplars_text": "Explain energy. Through the use of internet, videos or pictures, describe the sources of energy in Ghana, including fuel wood, hydro, solar and thermal. In groups, categorise sources of energy into renewable and non-renewable.", "competencies": ["Critical Thinking and Problem Solving (CP)", "Communication and Collaboration (CC)", "Personal Development and Leadership (PL)", "Digital Literacy (DL)", "CP 5.1: Ability to combine information and ideas from several sources to reach a conclusion.", "CP 5.2: Analyse and make distinct judgment about viewpoints expressed in an argument.", "CC 8.1: Speak clearly and explain ideas; share a narrative or extended answer while speaking to a group.", "CC 9.1: Demonstrate behaviour and skills of working towards group goals.", "PL 6.1: Ability to serve group members effectively.", "PL 6.3: Ability to manage time effectively.", "DL 5.1: Ascertain when information is needed and identify, locate, evaluate and effectively use it to solve a problem.", "DL 6.3: Use digital tools to create novel things."], "path": ["B7", "Strand 1: Environment", "Sub-strand 1: Environmental Issues", "B7.1.1.2", "B7.1.1.2.1"], "source": "NaCCA Social Studies CCP (B7–B9), 2020/2021", "keywords": ["strand", "skills", "conserving", "Strand", "sources", "Ghana", "Environmental", "demonstrate", "B7", "Examine", "Issues", "energy", "Environment"], "metadata": {"curriculum": "CCP", "subject": "Social Studies", "country": "Ghana", "license": "© NaCCA, Ministry of Education 2021"}}
{"id": "12c8b0abf7607411", "year": "B7", "strand": "Strand 1: Environment", "substrand": "Sub-strand 1: Environmental Issues", "content_standard_code": "B7.1.1.2", "indicator_code": "B7.1.1.2.2", "title": "B7 · Strand 1: Environment · Sub-strand 1: Environmental Issues · B7.1.1.2 · B7.1.1.2.2", "text": "Year: B7\nStrand: Strand 1: Environment\nSub-strand: Sub-strand 1: Environmental Issues\nContent Standard (B7.1.1.2): Examine the sources of energy and demonstrate the skills of conserving energy in Ghana\nIndicator (B7.1.1.2.2): Examine the benefits of using renewable energy.\nCore Competencies: CP; CC; CC 9.1; CP 5.2: Analyse and make distinct judgment about viewpoints expressed in an argument.; CC 8.1: Speak clearly and explain ideas; share a narrative or extended answer while speaking to a group.; CC 9.1: Demonstrate behaviour and skills of working towards group goals.", "exemplars_text": "", "competencies": ["CP", "CC", "CC 9.1", "CP 5.2: Analyse and make distinct judgment about viewpoints expressed in an argument.", "CC 8.1: Speak clearly and explain ideas; share a narrative or extended answer while speaking to a group.", "CC 9.1: Demonstrate behaviour and skills of working towards group goals."], "path": ["B7", "Strand 1: Environment", "Sub-strand 1: Environmental Issues", "B7.1.1.2", "B7.1.1.2.2"], "source": "NaCCA Social Studies CCP (B7–B9), 2020/2021", "keywords": ["strand", "skills", "conserving", "Strand", "sources", "Ghana", "renewable", "Environmental", "demonstrate", "B7", "using", "Examine", "Issues", "benefits", "energy", "Environment"], "metadata": {"curriculum": "CCP", "subject": "Social Studies", "country": "Ghana", "license": "© NaCCA, Ministry of Education 2021"}}
{"id": "677080c6b2ff9c07", "year": "B7", "strand": "Strand 1: Environment", "substrand": "Sub-strand 1: Environmental Issues", "content_standard_code": "B7.1.1.2", "indicator_code": "B7.1.1.2.3", "title": "B7 · Strand 1: Environment · Sub-strand 1: Environmental Issues · B7.1.1.2 · B7.1.1.2.3", "text": "Year: B7\nStrand: Strand 1: Environment\nSub-strand: Sub-strand 1: Environmental Issues\nContent Standard (B7.1.1.2): Examine the sources of energy and demonstrate the skills of conserving energy in Ghana\nIndicator (B7.1.1.2.3): Examine the benefits of using non-renewable energy sources.\nCore Competencies: CP; CC; CC 9.1; CP 5.2: Analyse and make distinct judgment about viewpoints expressed in an argument.; CC 8.1: Speak clearly and explain ideas; share a narrative or extended answer while speaking to a group.; CC 9.1: Demonstrate behaviour and skills of working towards group goals.", "exemplars_text": "", "competencies": ["CP", "CC", "CC 9.1", "CP 5.2: Analyse and make distinct judgment about viewpoints expressed in an argument.", "CC 8.1: Speak clearly and explain ideas; share a narrative or extended answer while speaking to a group.", "CC 9.1: Demonstrate behaviour and skills of working towards group goals."], "path": ["B7", "Strand 1: Environment", "Sub-strand 1: Environmental Issues", "B7.1.1.2", "B7.1.1.2.3"], "source": "NaCCA Social Studies CCP (B7–B9), 2020/2021", "keywords": ["strand", "skills", "conserving", "Strand", "sources", "Ghana", "renewable", "Environmental", "demonstrate", "B7", "using", "Examine", "Issues", "benefits", "energy", "Environment"], "metadata": {"curriculum": "CCP", "subject": "Social Studies", "country": "Ghana", "license": "© NaCCA, Ministry of Education 2021"}}
{"id": "c4905572bbd10dae", "year": "B7", "strand": "Strand 1: Environment", "substrand": "Sub-strand 1: Environmental Issues", "content_standard_code": "B7.1.1.2", "indicator_code": "B7.1.1.2.4", "title": "B7 · Strand 1: Environment · Sub-strand 1: Environmental Issues · B7.1.1.2 · B7.1.1.2.4", "text": "Year: B7\nStrand: Strand 1: Environment\nSub-strand: Sub-strand 1: Environmental Issues\nContent Standard (B7.1.1.2): Examine the sources of energy and demonstrate the skills of conserving energy in Ghana\nIndicator (B7.1.1.2.4): Discuss and design posters to show how different sources of energy are used.\nCore Competencies: CP; CC; CC 9.1; PL; CP 5.2: Analyse and make distinct judgment about viewpoints expressed in an argument.; CC 8.1: Speak clearly and explain ideas; share a narrative or extended answer while speaking to a group.; CC 9.1: Demonstrate behaviour and skills of working towards group goals.; PL 6.1: Serve group members effectively.; PL 6.3: Manage time effectively.", "exemplars_text": "", "competencies": ["CP", "CC", "CC 9.1", "PL", "CP 5.2: Analyse and make distinct judgment about viewpoints expressed in an argument.", "CC 8.1: Speak clearly and explain ideas; share a narrative or extended answer while speaking to a group.", "CC 9.1: Demonstrate behaviour and skills of working towards group goals.", "PL 6.1: Serve group members effectively.", "PL 6.3: Manage time effectively."], "path": ["B7", "Strand 1: Environment", "Sub-strand 1: Environmental Issues", "B7.1.1.2", "B7.1.1.2.4"], "source": "NaCCA Social Studies CCP (B7–B9), 2020/2021", "keywords": ["Strand", "sources", "Ghana", "different", "posters", "demonstrate", "Examine", "energy", "B7", "Environment", "conserving", "show", "used", "Discuss", "strand", "skills", "design", "Environmental", "Issues"], "metadata": {"curriculum": "CCP", "subject": "Social Studies", "country": "Ghana", "license": "© NaCCA, Ministry of Education 2021"}}
{"id": "a3e7f5e9a0c3e422", "year": "B7", "strand": "Strand 1: Environment", "substrand": "Sub-strand 1: Environmental Issues", "content_standard_code": "B7.1.1.2", "indicator_code": "B7.1.1.2.5", "title": "B7 · Strand 1: Environment · Sub-strand 1: Environmental Issues · B7.1.1.2 · B7.1.1.2.5", "text": "Year: B7\nStrand: Strand 1: Environment\nSub-strand: Sub-strand 1: Environmental Issues\nContent Standard (B7.1.1.2): Examine the sources of energy and demonstrate the skills of conserving energy in Ghana\nIndicator (B7.1.1.2.5): Discuss how sun or wind can be used to heat or perform work.\nCore Competencies: CP; CC; CC 9.1; PL; CP 5.2; CC 8.1; CC 9.1; PL 6.1; PL 6.3", "exemplars_text": "", "competencies": ["CP", "CC", "CC 9.1", "PL", "CP 5.2", "CC 8.1", "CC 9.1", "PL 6.1", "PL 6.3"], "path": ["B7", "Strand 1: Environment", "Sub-strand 1: Environmental Issues", "B7.1.1.2", "B7.1.1.2.5"], "source": "NaCCA Social Studies CCP (B7–B9), 2020/2021", "keywords": ["Strand", "sources", "Ghana", "perform", "wind", "work", "demonstrate", "Examine", "energy", "B7", "Environment", "conserving", "used", "heat", "Discuss", "strand", "skills", "Environmental", "Issues"], "metadata": {"curriculum": "CCP", "subject": "Social Studies", "country": "Ghana", "license": "© NaCCA, Ministry of Education 2021"}}
{"id": "7ad63f233b3a6502", "year": "B7", "strand": "Strand 1: Environment", "substrand": "Sub-strand 1: Environmental Issues", "content_standard_code": "B7.1.1.2", "indicator_code": "B7.1.1.2.6", "title": "B7 · Strand 1: Environment · Sub-strand 1: Environmental Issues · B7.1.1.2 · B7.1.1.2.6", "text": "Year: B7\nStrand: Strand 1: Environment\nSub-strand: Sub-strand 1: Environmental Issues\nContent Standard (B7.1.1.2): Examine the sources of energy and demonstrate the skills of conserving energy in Ghana\nIndicator (B7.1.1.2.6): Identify ways of using energy efficiently.\nCore Competencies: CP; CC; CC 9.1; CP 5.2; CC 8.1; CC 9.1", "exemplars_text": "", "competencies": ["CP", "CC", "CC 9.1", "CP 5.2", "CC 8.1", "CC 9.1"], "path": ["B7", "Strand 1: Environment", "Sub-strand 1: Environmental Issues", "B7.1.1.2", "B7.1.1.2.6"], "source": "NaCCA Social Studies CCP (B7–B9), 2020/2021", "keywords": ["strand", "skills", "conserving", "efficiently", "Strand", "sources", "ways", "Ghana", "Environmental", "demonstrate", "B7", "using", "Examine", "Issues", "energy", "Identify", "Environment"], "metadata": {"curriculum": "CCP", "subject": "Social Studies", "country": "Ghana", "license": "© NaCCA, Ministry of Education 2021"}}
{"id": "27ee32207233774d", "year": "B7", "strand": "Strand 1: Environment", "substrand": "Sub-strand 1: Environmental Issues", "content_standard_code": "B7.1.1.2", "indicator_code": "B7.1.1.2.7", "title": "B7 · Strand 1: Environment · Sub-strand 1: Environmental Issues · B7.1.1.2 · B7.1.1.2.7", "text": "Year: B7\nStrand: Strand 1: Environment\nSub-strand: Sub-strand 1: Environmental Issues\nContent Standard (B7.1.1.2): Examine the sources of energy and demonstrate the skills of conserving energy in Ghana\nIndicator (B7.1.1.2.7): Discuss why Ghana sometimes imports energy.\nCore Competencies: CP; CC; CC 9.1; PL; CP 5.2; CC 8.1; CC 9.1; PL 6.1; PL 6.3", "exemplars_text": "", "competencies": ["CP", "CC", "CC 9.1", "PL", "CP 5.2", "CC 8.1", "CC 9.1", "PL 6.1", "PL 6.3"], "path": ["B7", "Strand 1: Environment", "Sub-strand 1: Environmental Issues", "B7.1.1.2", "B7.1.1.2.7"], "source": "NaCCA Social Studies CCP (B7–B9), 2020/2021", "keywords": ["strand", "skills", "conserving", "Strand", "sources", "Ghana", "imports", "Environmental", "demonstrate", "B7", "Examine", "Issues", "sometimes", "energy", "Environment", "Discuss"], "metadata": {"curriculum": "CCP", "subject": "Social Studies", "country": "Ghana", "license": "© NaCCA, Ministry of Education 2021"}}
{"id": "6ece1b2574b1695f", "year": "B7", "strand": "Strand 1: Environment", "substrand": "Sub-strand 2: Mapping Skills", "content_standard_code": "B7.1.2.1", "indicator_code": "B7.1.2.1.1", "title": "B7 · Strand 1: Environment · Sub-strand 2: Mapping Skills · B7.1.2.1 · B7.1.2.1.1", "text": "Year: B7\nStrand: Strand 1: Environment\nSub-strand: Sub-strand 2: Mapping Skills\nContent Standard (B7.1.2.1): Demonstrate a range of mapping skills\nIndicator (B7.1.2.1.1): Demonstrate skills involved in mapping and locating places in the environment\nExemplars: Explain the following concepts: “maps” and “scale”. Identify types of maps (street maps, landscape/physical maps, national maps) using an atlas. Explore the importance of maps to different people (airline managers, fisherfolk, farmers, a family moving to a city). Identify components of maps: north arrow, scale, key (physical features such as rivers, lakes, mountains, coastline; human features such as settlements, plantations, industrial developments) using names, symbols, colours. Sketch a map of the school compound, marking the main features. Locate important landmarks in the community using maps (e.g., “the bank is 500 metres north of the JHS”).\nCore Competencies: CP; CC; PL; DL; CP 5.1: Combine information and ideas from several sources to reach a conclusion.; CC 8.1: Speak clearly and explain ideas; share an extended answer to a group.; DL 5.1: Identify, locate, evaluate and use information to solve a problem.; DL 6.3: Use digital tools to create novel things.; DL 5.3: Find and utilise digital content.; CI 5.5: Try new alternatives and different approaches.; CI 6.3: Select the most effective creative tools and explain choices.", "exemplars_text": "Explain the following concepts: “maps” and “scale”. Identify types of maps (street maps, landscape/physical maps, national maps) using an atlas. Explore the importance of maps to different people (airline managers, fisherfolk, farmers, a family moving to a city). Identify components of maps: north arrow, scale, key (physical features such as rivers, lakes, mountains, coastline; human features such as settlements, plantations, industrial developments) using names, symbols, colours. Sketch a map of the school compound, marking the main features. Locate important landmarks in the community using maps (e.g., “the bank is 500 metres north of the JHS”).", "competencies": ["CP", "CC", "PL", "DL", "CP 5.1: Combine information and ideas from several sources to reach a conclusion.", "CC 8.1: Speak clearly and explain ideas; share an extended answer to a group.", "DL 5.1: Identify, locate, evaluate and use information to solve a problem.", "DL 6.3: Use digital tools to create novel things.", "DL 5.3: Find and utilise digital content.", "CI 5.5: Try new alternatives and different approaches.", "CI 6.3: Select the most effective creative tools and explain choices."], "path": ["B7", "Strand 1: Environment", "Sub-strand 2: Mapping Skills", "B7.1.2.1", "B7.1.2.1.1"], "source": "NaCCA Social Studies CCP (B7–B9), 2020/2021", "keywords": ["strand", "skills", "Strand", "places", "Mapping", "range", "involved", "B7", "Skills", "mapping", "locating", "environment", "Environment", "Demonstrate"], "metadata": {"curriculum": "CCP", "subject": "Social Studies", "country": "Ghana", "license": "© NaCCA, Ministry of Education 2021"}}
{"id": "4a69682be1f0ce25", "year": "B7", "strand": "Strand 1: Environment", "substrand": "Sub-strand 3: Understanding Our Natural World", "content_standard_code": "B7.1.3.1", "indicator_code": "B7.1.3.1.1", "title": "B7 · Strand 1: Environment · Sub-strand 3: Understanding Our Natural World · B7.1.3.1 · B7.1.3.1.1", "text": "Year: B7\nStrand: Strand 1: Environment\nSub-strand: Sub-strand 3: Understanding Our Natural World\nContent Standard (B7.1.3.1): Show understanding of the world around us\nIndicator (B7.1.3.1.1): Examine major physical features of the earth\nExemplars: Identify major features of the earth such as mountain ranges, rivers, oceans, hot deserts and tropical rainforest. Using maps, locate: (i) Mountain ranges (Akuapim-Togo, Gambaga, Kwahu, Himalayas, Rockies, Andes, Alps); (ii) Rivers (Bia, Tano, Ankobra, Pra, Densu, Volta, Nile, Niger, Congo, Ganges, Yangtze, Amazon, Mississippi); (iii) Oceans (Atlantic, Arctic, Southern, Indian, Pacific); (iv) Hot deserts (Sahara, Kalahari, Gobi, Arabian); (v) Tropical rainforests (Amazon Rainforest). Discuss human activities that affect mountain ranges, rivers and oceans, and ways of protecting them. Discuss effects of plastic pollution on streams, ponds, rivers, dams, lakes and oceans.\nCore Competencies: CP; CI; CC; DL; CP 5.6: Demonstrate a thorough understanding of generalised concepts and task-specific facts.; CP 5.1: Combine information and ideas from several sources to reach a conclusion.; CI 5.4: Visualise alternatives; see possibilities, problems and challenges.; CI 6.4: Imagining and seeing things in a different way.; CC 8.1: Speak clearly and explain ideas; share extended answers to a group.; CC 9.1: Demonstrate skills for working toward group goals.; DL 5.1: Identify, locate, evaluate and use information to solve a problem.", "exemplars_text": "Identify major features of the earth such as mountain ranges, rivers, oceans, hot deserts and tropical rainforest. Using maps, locate: (i) Mountain ranges (Akuapim-Togo, Gambaga, Kwahu, Himalayas, Rockies, Andes, Alps); (ii) Rivers (Bia, Tano, Ankobra, Pra, Densu, Volta, Nile, Niger, Congo, Ganges, Yangtze, Amazon, Mississippi); (iii) Oceans (Atlantic, Arctic, Southern, Indian, Pacific); (iv) Hot deserts (Sahara, Kalahari, Gobi, Arabian); (v) Tropical rainforests (Amazon Rainforest). Discuss human activities that affect mountain ranges, rivers and oceans, and ways of protecting them. Discuss effects of plastic pollution on streams, ponds, rivers, dams, lakes and oceans.", "competencies": ["CP", "CI", "CC", "DL", "CP 5.6: Demonstrate a thorough understanding of generalised concepts and task-specific facts.", "CP 5.1: Combine information and ideas from several sources to reach a conclusion.", "CI 5.4: Visualise alternatives; see possibilities, problems and challenges.", "CI 6.4: Imagining and seeing things in a different way.", "CC 8.1: Speak clearly and explain ideas; share extended answers to a group.", "CC 9.1: Demonstrate skills for working toward group goals.", "DL 5.1: Identify, locate, evaluate and use information to solve a problem."], "path": ["B7", "Strand 1: Environment", "Sub-strand 3: Understanding Our Natural World", "B7.1.3.1", "B7.1.3.1.1"], "source": "NaCCA Social Studies CCP (B7–B9), 2020/2021", "keywords": ["strand", "around", "physical", "Show", "Strand", "earth", "Natural", "understanding", "B7", "major", "Examine", "World", "world", "Understanding", "features", "Environment"], "metadata": {"curriculum": "CCP", "subject": "Social Studies", "country": "Ghana", "license": "© NaCCA, Ministry of Education 2021"}}
{"id": "bc6275c464415a6e", "year": "B7", "strand": "Strand 1: Environment", "substrand": "Sub-strand 3: Understanding Our Natural World", "content_standard_code": "B7.1.3.2", "indicator_code": "B7.1.3.2.1", "title": "B7 · Strand 1: Environment · Sub-strand 3: Understanding Our Natural World · B7.1.3.2 · B7.1.3.2.1", "text": "Year: B7\nStrand: Strand 1: Environment\nSub-strand: Sub-strand 3: Understanding Our Natural World\nContent Standard (B7.1.3.2): Assess the issue of natural disasters and their management\nIndicator (B7.1.3.2.1): Examine natural disasters in the environment\nExemplars: Explain natural disasters. Watch documentaries on natural disasters. Mention examples: flood, drought, landslide, wildfire, earthquake, sea erosion. Identify natural disasters in Ghana. Suggest ways to manage disasters. Discuss the role of GMA and NADMO in early detection and management.\nCore Competencies: CP; CI; CC; DL; CP 5.6: Thorough understanding of concepts and task-specific facts.; CP 5.5: Effectively evaluate success of solutions used to solve complex problems.; CC 8.1: Speak clearly and explain ideas; share extended answers to a group.; DL 6.5: Recognise societal issues from use of digital technologies.", "exemplars_text": "Explain natural disasters. Watch documentaries on natural disasters. Mention examples: flood, drought, landslide, wildfire, earthquake, sea erosion. Identify natural disasters in Ghana. Suggest ways to manage disasters. Discuss the role of GMA and NADMO in early detection and management.", "competencies": ["CP", "CI", "CC", "DL", "CP 5.6: Thorough understanding of concepts and task-specific facts.", "CP 5.5: Effectively evaluate success of solutions used to solve complex problems.", "CC 8.1: Speak clearly and explain ideas; share extended answers to a group.", "DL 6.5: Recognise societal issues from use of digital technologies."], "path": ["B7", "Strand 1: Environment", "Sub-strand 3: Understanding Our Natural World", "B7.1.3.2", "B7.1.3.2.1"], "source": "NaCCA Social Studies CCP (B7–B9), 2020/2021", "keywords": ["strand", "Strand", "their", "Natural", "Assess", "issue", "disasters", "management", "B7", "environment", "Examine", "World", "Understanding", "Environment", "natural"], "metadata": {"curriculum": "CCP", "subject": "Social Studies", "country": "Ghana", "license": "© NaCCA, Ministry of Education 2021"}}
{"id": "825b3c0648be2352", "year": "B7", "strand": "Strand 2: Family Life", "substrand": "Sub-strand 1: Adolescent Reproductive Health", "content_standard_code": "B7.2.1.1", "indicator_code": "B7.2.1.1.1", "title": "B7 · Strand 2: Family Life · Sub-strand 1: Adolescent Reproductive Health · B7.2.1.1 · B7.2.1.1.1", "text": "Year: B7\nStrand: Strand 2: Family Life\nSub-strand: Sub-strand 1: Adolescent Reproductive Health\nContent Standard (B7.2.1.1): Demonstrate understanding of adolescent behaviour and reproductive health issues\nIndicator (B7.2.1.1.1): Examine issues on adolescent behaviour and reproductive health\nExemplars: Explain the concepts: (i) Adolescence (ii) Reproductive Health Discuss adolescent behaviours, including chastity, that support reproductive health. In groups, discuss why healthy behaviour during adolescence is important for the individual and the country. Invite a resource person (e.g., doctor or nurse) to discuss how some adolescent behaviours can harm reproductive health.\nCore Competencies: CP; PL; CC; CP 5.1: Combine information and ideas from several sources to reach a conclusion.; CC 8.1: Speak clearly and explain ideas; share extended answers to a group.; CC 9.1: Demonstrate behaviour and skills of working towards group goals.", "exemplars_text": "Explain the concepts: (i) Adolescence (ii) Reproductive Health Discuss adolescent behaviours, including chastity, that support reproductive health. In groups, discuss why healthy behaviour during adolescence is important for the individual and the country. Invite a resource person (e.g., doctor or nurse) to discuss how some adolescent behaviours can harm reproductive health.", "competencies": ["CP", "PL", "CC", "CP 5.1: Combine information and ideas from several sources to reach a conclusion.", "CC 8.1: Speak clearly and explain ideas; share extended answers to a group.", "CC 9.1: Demonstrate behaviour and skills of working towards group goals."], "path": ["B7", "Strand 2: Family Life", "Sub-strand 1: Adolescent Reproductive Health", "B7.2.1.1", "B7.2.1.1.1"], "source": "NaCCA Social Studies CCP (B7–B9), 2020/2021", "keywords": ["strand", "behaviour", "Strand", "Reproductive", "health", "Adolescent", "Demonstrate", "understanding", "adolescent", "reproductive", "Examine", "Health", "issues", "Life", "B7", "Family"], "metadata": {"curriculum": "CCP", "subject": "Social Studies", "country": "Ghana", "license": "© NaCCA, Ministry of Education 2021"}}
{"id": "ff4bc108fdc2bc3e", "year": "B7", "strand": "Strand 2: Family Life", "substrand": "Sub-strand 4: Population", "content_standard_code": "B7.2.4.1", "indicator_code": "B7.2.4.1.1", "title": "B7 · Strand 2: Family Life · Sub-strand 4: Population · B7.2.4.1 · B7.2.4.1.1", "text": "Year: B7\nStrand: Strand 2: Family Life\nSub-strand: Sub-strand 4: Population\nContent Standard (B7.2.4.1): Analyse the population structure in Ghana and its related issues\nIndicator (B7.2.4.1.1): Examine the components of population growth\nExemplars: Explain the concept of population growth. Discuss how population in Ghana has changed in the recent past. Compare Ghana’s population growth with that of some other countries in Africa and in the world. Discuss factors of population change: birth rate, death rate, migration. Investigate causes of high birth rates and high death rates in Ghana.\nCore Competencies: Critical Thinking and Problem Solving (CP); Personal Development and Leadership (DL); Communication and Collaboration (CC); Cultural Identity and Global Citizenship (CG); CP 5.1: Combine information and ideas from several sources to reach a conclusion.; CP 6.4: Identify important and appropriate criteria to evaluate each alternative.; CC 8.1: Speak clearly and explain ideas; share a narrative or extended answer while speaking to a group.; CC 9.1: Demonstrate behaviour and skills of working towards group goals.; DL 5.6: Preparedness to make better decisions using information.; CG: Exhibit a sense of nationality and global identity.", "exemplars_text": "Explain the concept of population growth. Discuss how population in Ghana has changed in the recent past. Compare Ghana’s population growth with that of some other countries in Africa and in the world. Discuss factors of population change: birth rate, death rate, migration. Investigate causes of high birth rates and high death rates in Ghana.", "competencies": ["Critical Thinking and Problem Solving (CP)", "Personal Development and Leadership (DL)", "Communication and Collaboration (CC)", "Cultural Identity and Global Citizenship (CG)", "CP 5.1: Combine information and ideas from several sources to reach a conclusion.", "CP 6.4: Identify important and appropriate criteria to evaluate each alternative.", "CC 8.1: Speak clearly and explain ideas; share a narrative or extended answer while speaking to a group.", "CC 9.1: Demonstrate behaviour and skills of working towards group goals.", "DL 5.6: Preparedness to make better decisions using information.", "CG: Exhibit a sense of nationality and global identity."], "path": ["B7", "Strand 2: Family Life", "Sub-strand 4: Population", "B7.2.4.1", "B7.2.4.1.1"], "source": "NaCCA Social Studies CCP (B7–B9), 2020/2021", "keywords": ["strand", "Strand", "structure", "Population", "Ghana", "related", "components", "Analyse", "growth", "Examine", "population", "issues", "Life", "B7", "Family"], "metadata": {"curriculum": "CCP", "subject": "Social Studies", "country": "Ghana", "license": "© NaCCA, Ministry of Education 2021"}}
{"id": "a97c923f0b8f5502", "year": "B7", "strand": "Strand 3: Sense of Purpose", "substrand": "Sub-strand 1: Self-Identity", "content_standard_code": "B7.3.1.1", "indicator_code": "B7.3.1.1.1", "title": "B7 · Strand 3: Sense of Purpose · Sub-strand 1: Self-Identity · B7.3.1.1 · B7.3.1.1.1", "text": "Year: B7\nStrand: Strand 3: Sense of Purpose\nSub-strand: Sub-strand 1: Self-Identity\nContent Standard (B7.3.1.1): Show understanding of self as a unique individual\nIndicator (B7.3.1.1.1): Exhibit knowledge of self-identity\nExemplars: Explain the concepts 'self' and 'self-identity'. Identify attitudes that enhance self-worth (self-confidence, can-do spirit, positive attitude toward life). Identify one’s strengths and weaknesses as a unique individual and discuss with peers. Examine reasons for knowing oneself, including accepting oneself and identifying one’s potential and abilities. Describe how an individual can develop capabilities (education/training, counselling, continuous practice, etc.).\nCore Competencies: Critical Thinking and Problem Solving (CP); Personal Development and Leadership (DL); Communication and Collaboration (CC); CP 5.1: Combine information and ideas from several sources to reach a conclusion.; CP 5.2: Analyse and make distinct judgment about viewpoints expressed in an argument.; CC 7.2: Interpret and respond to non-verbal communication.; CC 8.1: Speak clearly and explain ideas; share a narrative or extended answer while speaking to a group.; CC 9.1: Demonstrate behaviour and skills of working towards group goals.", "exemplars_text": "Explain the concepts 'self' and 'self-identity'. Identify attitudes that enhance self-worth (self-confidence, can-do spirit, positive attitude toward life). Identify one’s strengths and weaknesses as a unique individual and discuss with peers. Examine reasons for knowing oneself, including accepting oneself and identifying one’s potential and abilities. Describe how an individual can develop capabilities (education/training, counselling, continuous practice, etc.).", "competencies": ["Critical Thinking and Problem Solving (CP)", "Personal Development and Leadership (DL)", "Communication and Collaboration (CC)", "CP 5.1: Combine information and ideas from several sources to reach a conclusion.", "CP 5.2: Analyse and make distinct judgment about viewpoints expressed in an argument.", "CC 7.2: Interpret and respond to non-verbal communication.", "CC 8.1: Speak clearly and explain ideas; share a narrative or extended answer while speaking to a group.", "CC 9.1: Demonstrate behaviour and skills of working towards group goals."], "path": ["B7", "Strand 3: Sense of Purpose", "Sub-strand 1: Self-Identity", "B7.3.1.1", "B7.3.1.1.1"], "source": "NaCCA Social Studies CCP (B7–B9), 2020/2021", "keywords": ["strand", "knowledge", "Purpose", "Self", "Show", "Strand", "Identity", "Exhibit", "identity", "understanding", "self", "unique", "individual", "Sense", "B7"], "metadata": {"curriculum": "CCP", "subject": "Social Studies", "country": "Ghana", "license": "© NaCCA, Ministry of Education 2021"}}
{"id": "1d7fcf94f4ba3734", "year": "B7", "strand": "Strand 4: Law and Order", "substrand": "Sub-strand 1: Citizenship and Human Rights", "content_standard_code": "B7.4.1.1", "indicator_code": "B7.4.1.1.1", "title": "B7 · Strand 4: Law and Order · Sub-strand 1: Citizenship and Human Rights · B7.4.1.1 · B7.4.1.1.1", "text": "Year: B7\nStrand: Strand 4: Law and Order\nSub-strand: Sub-strand 1: Citizenship and Human Rights\nContent Standard (B7.4.1.1): Analyse the responsibilities of a citizen\nIndicator (B7.4.1.1.1): Examine the value of citizenship in nation building\nExemplars: Explain the concept of citizenship. Discuss the various ways of acquiring citizenship in Ghana (birth, adoption, registration, naturalisation). Examine the responsibilities of a Ghanaian citizen (obey rules/regulations, protect state property, report crime, respect national symbols, pay taxes, etc.). In groups, discuss good working attitudes (honesty, reporting crime, punctuality and regularity). Dramatise ways citizens contribute to national development (communal labour, reporting crime).\nCore Competencies: Critical Thinking and Problem Solving (CP); Personal Development and Leadership (DL); Communication and Collaboration (CC); Creativity and Innovation (CI); CP 5.1: Combine information and ideas from several sources to reach a conclusion.; CP 5.2: Analyse and make distinct judgment about viewpoints expressed in an argument.; CC 7.2: Interpret and respond to non-verbal communication (facial expressions, cues, gestures).; CC 8.1: Speak clearly and explain ideas; share a narrative or extended answer to a group.", "exemplars_text": "Explain the concept of citizenship. Discuss the various ways of acquiring citizenship in Ghana (birth, adoption, registration, naturalisation). Examine the responsibilities of a Ghanaian citizen (obey rules/regulations, protect state property, report crime, respect national symbols, pay taxes, etc.). In groups, discuss good working attitudes (honesty, reporting crime, punctuality and regularity). Dramatise ways citizens contribute to national development (communal labour, reporting crime).", "competencies": ["Critical Thinking and Problem Solving (CP)", "Personal Development and Leadership (DL)", "Communication and Collaboration (CC)", "Creativity and Innovation (CI)", "CP 5.1: Combine information and ideas from several sources to reach a conclusion.", "CP 5.2: Analyse and make distinct judgment about viewpoints expressed in an argument.", "CC 7.2: Interpret and respond to non-verbal communication (facial expressions, cues, gestures).", "CC 8.1: Speak clearly and explain ideas; share a narrative or extended answer to a group."], "path": ["B7", "Strand 4: Law and Order", "Sub-strand 1: Citizenship and Human Rights", "B7.4.1.1", "B7.4.1.1.1"], "source": "NaCCA Social Studies CCP (B7–B9), 2020/2021", "keywords": ["strand", "value", "Rights", "Strand", "Citizenship", "citizenship", "responsibilities", "citizen", "Analyse", "building", "Human", "Order", "Examine", "B7", "nation"], "metadata": {"curriculum": "CCP", "subject": "Social Studies", "country": "Ghana", "license": "© NaCCA, Ministry of Education 2021"}}
{"id": "5e17f34d7e551564", "year": "B9", "strand": "Strand 4: Law and Order", "substrand": "Sub-strand 3: The 1992 Constitution", "content_standard_code": "B9.4.3.1", "indicator_code": "B9.4.3.1.1", "title": "B9 · Strand 4: Law and Order · Sub-strand 3: The 1992 Constitution · B9.4.3.1 · B9.4.3.1.1", "text": "Year: B9\nStrand: Strand 4: Law and Order\nSub-strand: Sub-strand 3: The 1992 Constitution\nContent Standard (B9.4.3.1): Assess the relevance of the 1992 Constitution\nIndicator (B9.4.3.1.1): Examine the 1992 Constitution and its significance to national development\nExemplars: Explain the meaning of a constitution. Outline the main features of the 1992 Constitution. Identify the functions of the three main organs of government (legislature, executive, judiciary) using videos or pictures. Discuss rights, freedoms and obligations of citizens under the 1992 Constitution. Examine conditions under which citizens’ rights can be curtailed. Explain the importance of the 1992 Constitution to Ghanaians.\nCore Competencies: Critical Thinking and Problem Solving (CP); Communication and Collaboration (CC); Creativity and Innovation (CI); Digital Literacy (DL); CP 6.3: Identify important and appropriate alternatives.; CP 6.4: Identify criteria and use them to evaluate available alternatives.; CP 6.5: Select alternatives that meet selected criteria.; CP 6.6: Recognise and explain results after implementation of plans.; DL 5.1: Identify, locate, evaluate and effectively use information to solve a problem.; DL 5.3: Find and utilise digital content.; CC 8.2: Explain ideas in a clear order with relevant detail.", "exemplars_text": "Explain the meaning of a constitution. Outline the main features of the 1992 Constitution. Identify the functions of the three main organs of government (legislature, executive, judiciary) using videos or pictures. Discuss rights, freedoms and obligations of citizens under the 1992 Constitution. Examine conditions under which citizens’ rights can be curtailed. Explain the importance of the 1992 Constitution to Ghanaians.", "competencies": ["Critical Thinking and Problem Solving (CP)", "Communication and Collaboration (CC)", "Creativity and Innovation (CI)", "Digital Literacy (DL)", "CP 6.3: Identify important and appropriate alternatives.", "CP 6.4: Identify criteria and use them to evaluate available alternatives.", "CP 6.5: Select alternatives that meet selected criteria.", "CP 6.6: Recognise and explain results after implementation of plans.", "DL 5.1: Identify, locate, evaluate and effectively use information to solve a problem.", "DL 5.3: Find and utilise digital content.", "CC 8.2: Explain ideas in a clear order with relevant detail."], "path": ["B9", "Strand 4: Law and Order", "Sub-strand 3: The 1992 Constitution", "B9.4.3.1", "B9.4.3.1.1"], "source": "NaCCA Social Studies CCP (B7–B9), 2020/2021", "keywords": ["strand", "significance", "Strand", "Constitution", "development", "relevance", "national", "B9", "Order", "Examine", "Assess"], "metadata": {"curriculum": "CCP", "subject": "Social Studies", "country": "Ghana", "license": "© NaCCA, Ministry of Education 2021"}}
{"id": "a4ef3306952b00c6", "year": "B9", "strand": "Strand 5: Socio-Economic Development", "substrand": "Sub-strand 4: Science and Technology", "content_standard_code": "B9.5.4.1", "indicator_code": "B9.5.4.1.X", "title": "B9 · Strand 5: Socio-Economic Development · Sub-strand 4: Science and Technology · B9.5.4.1 · B9.5.4.1.X", "text": "Year: B9\nStrand: Strand 5: Socio-Economic Development\nSub-strand: Sub-strand 4: Science and Technology\nContent Standard (B9.5.4.1): Analyse the contribution of science and technology to national development\nIndicator (B9.5.4.1.X): Examine the role of science and technology in sectors such as mining, education, agriculture and energy generation.\nExemplars: Investigate and present (using the Internet) the role of science and technology in Ghana’s development. Examine problems impeding development of science and technology in Ghana. Suggest ways of promoting science and technology in Ghana. Project: Identify a problem in the school and use knowledge in science and technology to solve it.\nCore Competencies: CP; CI; DL; CC; CI 5.1: Examine alternatives in creating new things.; CI 5.4: Visualise alternatives; see possibilities and challenges.; CP 5.1: Combine information and ideas from several sources to reach a conclusion.; DL 5.1: Identify, locate, evaluate and effectively use information to solve a problem.; DL 5.3: Find and utilise digital content.; CP 6.4: Identify important and appropriate criteria and use them to evaluate alternatives.; CC 8.2: Explain ideas in a clear order with relevant detail.", "exemplars_text": "Investigate and present (using the Internet) the role of science and technology in Ghana’s development. Examine problems impeding development of science and technology in Ghana. Suggest ways of promoting science and technology in Ghana. Project: Identify a problem in the school and use knowledge in science and technology to solve it.", "competencies": ["CP", "CI", "DL", "CC", "CI 5.1: Examine alternatives in creating new things.", "CI 5.4: Visualise alternatives; see possibilities and challenges.", "CP 5.1: Combine information and ideas from several sources to reach a conclusion.", "DL 5.1: Identify, locate, evaluate and effectively use information to solve a problem.", "DL 5.3: Find and utilise digital content.", "CP 6.4: Identify important and appropriate criteria and use them to evaluate alternatives.", "CC 8.2: Explain ideas in a clear order with relevant detail."], "path": ["B9", "Strand 5: Socio-Economic Development", "Sub-strand 4: Science and Technology", "B9.5.4.1", "B9.5.4.1.X"], "source": "NaCCA Social Studies CCP (B7–B9), 2020/2021", "keywords": ["Economic", "Strand", "development", "Technology", "Science", "education", "national", "sectors", "Examine", "energy", "role", "Development", "generation", "Analyse", "such", "mining", "Socio", "contribution", "strand", "technology", "science", "B9", "agriculture"], "metadata": {"curriculum": "CCP", "subject": "Social Studies", "country": "Ghana", "license": "© NaCCA, Ministry of Education 2021"}}
